Category,Denial Types,Description,Denial AI Agent Solution,Input Data Source
1. Administrative Denials,"Eligibility, Authorization, Timely Filing, Incomplete Info, Duplicate Claims, COB",Denials due to administrative non-compliance,"AI Agent verifies eligibility and authorization in real-time, flags missing info, and automates resubmissions.","EDI 837/835 data, payer policy guidelines, eligibility databases"
2. Clinical Denials,"Medical Necessity, Experimental, Non-Covered Service, Level of Care, Place of Service",Issues with medical need and service appropriateness,"AI Agent reviews clinical documentation, matches to medical necessity guidelines, and suggests additional documentation.","Medical records, payer-specific medical policies, federal and state medical necessity guidelines"
3. Compliance Denials,"Coding, Modifier, Billing Rule Violations","Errors in coding, modifiers, or billing rules","AI Agent checks coding compliance, applies correct modifiers, and flags billing rule errors before submission.","Coding guidelines (ICD-10, CPT, HCPCS), payer billing rules, compliance documents"
4. Soft Denials,"Documentation Issues, Medical Review, Minor Coding Errors","Reworkable denials, often related to documentation or minor errors","AI Agent identifies missing documentation, alerts teams, and automates resubmission once completed.","Electronic health records (EHR), best practices for documentation, payer documentation requirements"
5. Hard Denials,"Absolute Non-Coverage, Patient Responsibility",Non-reversible denials requiring appeals,AI Agent suggests appeal opportunities based on payer rules and provides pre-filled templates for faster resolution.,"Payer-specific policies, appeal guidelines, historical denial overturn success rates"
6. Specialty Denials,"Behavioral Health, Oncology, Cardiology, Orthopedics, Radiology",Specialty-specific claims needing additional scrutiny,"AI Agent understands specialty nuances, flags errors, and recommends documentation to ensure approval.","Specialty-specific payer policies, federal mandates for specialty care, historical EDI data"
7. Zero-Balance Denials,Write-Offs,Claims reduced to zero due to coverage or adjustments,"AI Agent detects revenue opportunities in zero-balance claims, flagging write-offs for potential recovery.","EDI 835 data, provider contracts, historical patterns in zero-balance adjustments"
8. Preventive Denials,"Routine Care, Wellness Services",Preventive services outside plan restrictions,"AI Agent checks payer policies, suggests adjustments, and re-qualifies routine services for approval.","Payer preventive guidelines, federal preventive care mandates (e.g., ACA), patient medical history"
9. Ambulatory Denials,Ambulatory Services,Coverage and coding issues in outpatient care,"AI Agent checks codes, ensures eligibility, and proactively submits corrected claims.","Outpatient coding guidelines, ambulatory care policies, historical denial trends for outpatient services"
10. Health System Denials,"Provider-Based, Facility-Based",Network or facility alignment issues,"AI Agent verifies provider status in real-time, reducing out-of-network errors and facility issues.","Network provider databases, payer-specific provider status and alignment requirements"
11. Complex Denials,"Multiple Issues, Classification, High-Risk Conditions","Multi-factorial denials, often complex","AI Agent analyzes multi-issue claims, corrects each issue, and manages bundled resubmissions.","Comprehensive claims data (EDI 837), payer rules, historical outcomes for complex denial cases"
12. High Dollar Amount Denials,Large Claim Amount,Denials needing detailed review due to high dollar value,"AI Agent prioritizes high-value claims, verifies documentation, and submits detailed appeals.","Payer-specific high-dollar policies, historical high-dollar claim outcomes, detailed EHR data"
13. Low Dollar Amount Denials,Small Claim Amount,Smaller claims that may not be cost-effective to appeal,AI Agent corrects small claims in bulk and automates batch resubmissions to recover revenue.,"Historical EDI 835 data on low-dollar denials, payer thresholds for appeal-worthy claims"
14. Technical Denials,"EDI, System Errors",Transmission or system-based issues,"AI Agent identifies and corrects system errors, ensuring EDI compliance and reducing rejections.","EDI 837/835 data, EDI transmission error logs, historical system error correction data"
15. Payer-Specific Denials,"Policy-Based, Network Exclusion",Denials tied to payer policies or network restrictions,AI Agent reviews payer-specific policies and adjusts network preferences for compliance.,"Payer contract terms, location-based policies, historical success rates by payer"
16. Provider Responsibility,"Contractual Adjustments, Write-Offs",Denials based on provider agreements with payers,"AI Agent tracks agreements, flags non-compliant claims, and aligns submissions with contractual terms.","Provider contracts, EDI 835 adjustment data, payer agreements"
17. Patient-Related Denials,"COB, Non-Eligible Dependent, Out-of-Pocket",Issues with patient eligibility or responsibilities,"AI Agent coordinates benefits, verifies secondary insurance, and provides patient responsibility insights.","Insurance eligibility databases, patient financial responsibility guidelines, COB policies"
18. Billing-Related Denials,"Global Period, Overlapping Services",Denials for global periods or duplicate services,"AI Agent manages global billing rules, avoids duplicates, and identifies re-submission opportunities.","Billing cycle rules, provider contracts, historical data on service overlap patterns"
19. Fraud-Related Denials,"Upcoding, Unbundling",Denials tied to suspected fraud,"AI Agent detects upcoding and unbundling, suggests corrections, and flags for review.","Historical EDI 837/835 claims data, coding compliance guidelines, fraud detection algorithms"
20. Benefit Exclusion Denials,"Pre-Existing Conditions, Excluded Benefits",Services outside benefit terms,"AI Agent flags exclusions, suggests documentation to qualify under exceptions, and aligns with benefit terms.","Payer-specific benefit exclusions, historical denial data on benefit limitations, patient medical history"
21. Utilization Management,"Case Management, Length of Stay",Denials based on utilization reviews,"AI Agent monitors utilization, ensures approved lengths, and identifies cases for re-approval.","Utilization guidelines, historical length-of-stay data, case management protocols"
22. Appeals Denials,"Failed Appeals, Exhausted Appeal Rights",Denials after appeal attempts are exhausted,AI Agent drafts optimized appeal letters and supports complex appeal cases.,"Historical appeal success rates, payer appeal guidelines, previous claim outcomes"
23. Frequency Limitation,"Service Frequency, Testing Frequency",Exceeding frequency limits for services or tests,"AI Agent tracks service limits, alerts providers, and justifies additional services with documentation.","Payer frequency guidelines, medical history data, provider records on service frequency"
24. Geographic Restrictions,"Out-of-Region, Remote Services",Restrictions based on service location,"AI Agent flags location restrictions, verifies coverage for telemedicine, and assists in requalification.","Payer location-based policies, telehealth regulations, location-based coverage rules"
25. Medical Device Denials,"DME, Implant",Coverage issues with durable medical equipment or implants,"AI Agent verifies DME requirements, checks authorization, and flags high-value devices for appeal.","DME guidelines, provider contracts for medical devices, payer policies on implants"
26. Emergency Service Denials,"Non-Emergent ER, Out-of-Network ER",ER visits denied for lack of emergency need,"AI Agent reviews diagnosis codes for emergency need, flags out-of-network cases for review.","ER coverage guidelines, patient medical records, payer ER coverage policies"
27. Behavioral Health Specific,"Psychiatric Services, Substance Abuse",Denials related to mental health and addiction,"AI Agent ensures compliance with mental health parity, flags high-risk cases for additional documentation.","Behavioral health mandates (e.g., mental health parity laws), patient treatment history, payer BH policies"
28. Discharge Status,"Inappropriate Discharge, Early Discharge",Issues with discharge planning and status,"AI Agent verifies discharge criteria, checks for documentation, and suggests corrections to meet payer guidelines.","Discharge planning documents, patient records, payer-specific discharge policies"
29. Chronic Condition Management,"Chronic Care, Disease-Specific",Coverage limits for chronic disease management,"AI Agent flags chronic care claims, verifies coverage requirements, and provides continuity-of-care documentation.","Chronic care guidelines, payer chronic condition policies, patient treatment records"
30. Preventive Vaccine Denials,"Routine Vaccines, Travel Vaccines",Denials related to vaccine coverage,"AI Agent tracks frequency, flags routine vaccinations, and provides documentation to justify coverage.","CDC preventive vaccine guidelines, payer policies on preventive services, patient vaccination history"
31. Experimental Procedure,"Non-FDA Approved, Clinical Trial",Denials for experimental treatments or trials,"AI Agent flags experimental treatments, matches trials to FDA approval status, and provides justification.","FDA approval status, payer-specific experimental policies, clinical trial registry data"
32. Socioeconomic/Situational,"Transportation, Housing Support",Denials for non-medical support services,"AI Agent checks payer policies for support services, flags transport, and justifies medically necessary cases.","Payer guidelines for non-medical services, CMS guidelines on social determinants of health, patient needs"
33. Medicare/Medicaid Compliance,"CMS Coding, Coverage Limitations",Denials tied to CMS-specific coding or coverage rules,"AI Agent aligns claims with CMS rules, checks coding compliance, and flags exceptions for review.","Medicare/Medicaid policies, CMS coding guidelines, compliance documents"
34. Medicare Advantage,"MA Authorization, Non-Medicare Covered Services",Stricter requirements under Medicare Advantage,"AI Agent ensures Medicare Advantage compliance, verifies authorizations, and flags non-covered services.","Medicare Advantage policies, patient eligibility databases, provider networks"
35. Medicare Part B,"Outpatient Services, Ambulance",Part B-specific denial categories,"AI Agent verifies Part B coverage, flags services exceeding coverage, and submits corrections.","Medicare Part B policies, outpatient service guidelines, patient medical records"
36. Medicaid Integrity,"State-Specific Rules, Enrollment, Audit",Denials from Medicaid audits or compliance checks,"AI Agent tracks state-specific rules, ensures Medicaid enrollment compliance, and flags audit risks.","Medicaid state-specific policies, provider Medicaid enrollment, audit history and outcomes"
37. CMS NCD/LCD Compliance,"NCD, LCD Compliance",Compliance with CMS National and Local Coverage Decisions,AI Agent aligns claims with NCD/LCD guidelines and provides specific documentation for each case.,"CMS NCD/LCD documents, historical compliance outcomes, payer policies for NCD/LCD compliance"
38. Medicare Preventive,"Wellness Visit, Screening Frequency",Denials based on preventive care frequency,"AI Agent flags frequency limits for screenings, provides documentation, and aligns with Medicare guidelines.","Medicare preventive services guidelines, CMS frequency rules, patient preventive care history"
39. SNF Denials,"Level of Care, Duration",Skilled Nursing Facility-specific denials,"AI Agent checks SNF criteria, verifies stay duration, and ensures level of care meets guidelines.","SNF coverage policies, patient length-of-stay records, payer-specific SNF criteria"
40. Medicaid MCO Denials,"MCO Authorization, Non-Emergent ER",Managed Care Organization denial categories,"AI Agent monitors MCO rules, verifies authorizations, and ensures emergency room compliance.","MCO-specific policies, emergency care guidelines, patient history"
41. CMS Quality Reporting,"Quality Metrics, Value-Based Programs",Denials based on quality reporting standards,"AI Agent ensures quality metric compliance, flags under-reporting, and helps meet value-based care standards.","Quality metric guidelines (e.g., MIPS, QPP), value-based care policies, historical quality reporting data"
42. Bundling Initiative,"BPCI, Care Coordination",Denials under CMS bundled payment initiatives,"AI Agent ensures bundled service compliance, coordinates care documentation, and flags exceptions.","Bundled payment guidelines, care coordination documents, historical BPCI data"
43. Inpatient Denials,"Length of Stay, Readmission, Observation",Denials specific to inpatient care,"AI Agent monitors inpatient criteria, flags readmission risks, and ensures compliance with inpatient rules.","Inpatient admission guidelines, patient records, Medicare Two-Midnight rule documentation"
44. Outpatient Denials,"Procedure, Observation Stay, Lab Tests",Denials specific to outpatient care settings,"AI Agent verifies outpatient requirements, checks observation status, and ensures lab test compliance.","Outpatient coding rules, payer-specific outpatient coverage guidelines, historical outpatient denial data"
45. Rehabilitation/Therapy,"PT, OT, Speech Therapy",Denials related to therapy frequency or necessity,"AI Agent tracks therapy frequencies, verifies medical necessity, and flags high-need cases for appeal.","Rehab therapy guidelines, patient medical history, payer-specific therapy policies"
46. Home Health Care,"Non-Skilled, Visit Frequency",Issues with home health care coverage limits,"AI Agent monitors home health criteria, flags non-skilled claims, and verifies visit frequency compliance.","Home health care policies, historical EDI 837 data, Medicare/Medicaid home health guidelines"
47. Dental/Vision Denials,"Dental Procedures, Vision Care",Denials specific to dental or vision coverage,"AI Agent checks dental/vision eligibility, flags uncovered services, and suggests compliant resubmissions.","Dental and vision benefit policies, historical denial patterns for dental/vision claims, payer requirements"
48. End-of-Life Care,"Hospice, Palliative Care",Denials for end-of-life or palliative services,"AI Agent ensures hospice/palliative compliance, provides documentation, and verifies family consent for coverage.","End-of-life care guidelines, patient health records, hospice care policies"
49. Credentialing,"Non-Credentialed Provider, Out-of-Network Specialist",Issues with provider network status or credentials,"AI Agent verifies provider credential status, flags out-of-network errors, and suggests corrections.","Provider credentialing records, network provider databases, payer requirements for credentialing"
50. Ancillary Services,"Lab Tests, Imaging Studies",Denials for ancillary services without proper approval,"AI Agent ensures approvals for labs/imaging, flags unauthorized tests, and recommends compliant resubmission.","Ancillary service policies, payer-specific requirements for labs/imaging, EDI 837 data on ancillary claims"
51. Specialized Equipment,"DME, Orthotics/Prosthetics",Denials for non-essential equipment,"AI Agent verifies DME needs, flags orthotics for coverage compliance, and provides documentation.","DME and orthotics policies, provider records, historical data on equipment denials"
52. Preventable Condition,"Hospital-Acquired Infection, Injury",Denials for preventable conditions acquired in care,"AI Agent tracks infection risks, provides documentation, and flags preventable conditions for internal review.","Preventable condition guidelines, hospital-acquired condition policies, patient health records"
53. Telemedicine,"Non-Covered Telehealth, Location-Based",Telemedicine restrictions based on location or service type,"AI Agent checks telehealth eligibility, flags non-covered areas, and suggests compliant resubmissions.","Telemedicine policies by state, payer-specific telehealth rules, patient location data"
54. Age-Specific,"Pediatric, Senior Services",Age-based service restrictions,"AI Agent verifies age-related coverage, flags services based on age, and ensures pediatric/senior compliance.","Age-based benefit policies, historical denial data by age group, payer age restrictions"
55. Family Planning,"Contraceptive Coverage, Fertility Treatments",Reproductive health coverage issues,"AI Agent ensures family planning compliance, flags uncovered services, and recommends appeals for exclusions.","Family planning policies, payer requirements for fertility treatments, historical claims on family planning"
56. SNF vs. Inpatient,Incorrect Level of Care,Errors in classification between SNF and inpatient,AI Agent verifies SNF vs. inpatient classification and ensures correct submission.,"SNF guidelines, inpatient classification rules, historical misclassification data"
57. Maternity/Prenatal Care,"Prenatal Visits, Maternity Care",Denials related to maternity coverage,"AI Agent verifies prenatal/maternity guidelines, flags coverage issues, and ensures correct billing.","Maternity care policies, historical claims data, federal/state maternity mandates"
58. Non-Medically Necessary,Cosmetic Procedures,Denials for procedures deemed elective or cosmetic,"AI Agent flags elective services, checks cosmetic exclusions, and prevents submission of non-covered procedures.","Payer-specific cosmetic procedure policies, EDI 837/835 data, patient medical records"
59. Inpatient Readmissions,"Short Interval, Preventable Readmissions",Readmission denials based on avoidability or timing,"AI Agent monitors readmission criteria, flags preventable cases, and supports continuity of care to avoid rejections.","Readmission guidelines, patient treatment records, Medicare readmission reduction program requirements"
60. Case Management Denials,Failure to Meet Criteria,Denials due to unmet case management criteria,"AI Agent tracks case management criteria, flags potential issues, and ensures compliance.","Case management guidelines, payer-specific requirements, historical compliance data"
61. Managed Care Denials,MCO Network Requirements,Denials specific to managed care requirements,"AI Agent verifies MCO-specific guidelines, flags network requirements, and prevents out-of-network rejections.","MCO contracts, payer-specific MCO policies, network eligibility data"
62. Diagnostic Test Denials,"Frequency Limits, Non-Compliance with Guidelines",Diagnostic test restrictions and limitations,"AI Agent checks test frequencies, ensures guideline compliance, and suggests documentation.","Diagnostic test policies, frequency limit guidelines, patient records"
63. Observation Status Denials,Observation vs Inpatient,Classification disputes between observation and inpatient,"AI Agent monitors observation vs. inpatient criteria, flags misclassifications, and supports proper claim submissions.","Observation status policies, payer-specific inpatient rules, historical classification data"
64. Bundled Service Denials,Incorrectly Bundled Procedures,Issues with unbundled or over-bundled services,"AI Agent ensures proper bundling/unbundling, flags miscategorized claims, and verifies coding.","Bundling guidelines, payer-specific bundling policies, EDI 837 data on bundled claims"
65. Medicare Advantage Appeals,Final Denial on Appeal,Final appeals rejected under Medicare Advantage,"AI Agent optimizes appeal submission, tracks success rates, and drafts follow-up appeals for improved outcomes.","Historical appeal success rates, Medicare Advantage guidelines, federal appeal rights documentation"